{"contract_version":"1.0.0","identity":{"fusion_id":"FUS-11111111111111111111111111111111","fusion_key":"FUK-653931439FAF8B473B1D4980E483206DAF065DBECAD135A0BB9367089E588FCC","run_id":"RUN-11111111111111111111111111111111","coordinator_execution_id":"EXE-AAAAAAAAAAAAAAAAAAAAAAAAAAAAAAAA","round":1},"inputs":{"recommendations":[{"recommendation_id":"REC-11111111111111111111111111111111","recommendation_key":"RCK-B221BE3D3DBC757E9FD394930157F16E2098D539CB244DC70A5899232ED9D33E","execution_id":"EXE-11111111111111111111111111111111","task_id":"TSK-11111111111111111111111111111111","agent_role":"quality","action":"HOLD_BATCH","severity":"HIGH","confidence":0.91},{"recommendation_id":"REC-22222222222222222222222222222222","recommendation_key":"RCK-3C2D9E76B7E973F458AE9142481B0C550E816DE537591B56A9A64B89505CDE36","execution_id":"EXE-22222222222222222222222222222222","task_id":"TSK-22222222222222222222222222222222","agent_role":"production","action":"PASS","severity":"LOW","confidence":0.88},{"recommendation_id":"REC-33333333333333333333333333333333","recommendation_key":"RCK-01DC0B2680471E5CF4112168CD8A2ECF83C35E2A1445173563375B0C652A2277","execution_id":"EXE-33333333333333333333333333333333","task_id":"TSK-33333333333333333333333333333333","agent_role":"sla","action":"HOLD_BATCH","severity":"MEDIUM","confidence":0.82}],"missing_roles":[]},"fusion":{"proposed_action":"HOLD_BATCH","authorization_state":"NOT_EVALUATED","candidates":[{"action":"HOLD_BATCH","rank":1,"score":0.86,"supporting_roles":["quality","sla"],"opposing_roles":["production"]},{"action":"PASS","rank":2,"score":0.31,"supporting_roles":["production"],"opposing_roles":["quality","sla"]}],"has_conflict":true,"conflict_codes":["SPECIALIST_ACTION_DISAGREEMENT"],"evidence_refs":["recommendation:quality-1","recommendation:production-1","recommendation:sla-1"],"reason_codes":["QUALITY_AND_SLA_AGREE"]},"generated_at":"2026-08-19T08:00:00Z"}
